"“God calls himself ""Baseer"" [Observant], so that the knowledge that He is watching you may keep you from sinning.”"
"“Knowledge that is acquired
is not like this. Those who have it worry if audiences like it or not.
It's a bait for popularity. Disputational knowing wants customers. It has no soul...
The only real customer is God. Chew quietly
your sweet sugarcane God-Love, and stay playfully childish.”"
"“The angel is free because of his knowledge, the beast because of his ignorance. Between the two remains the son of man to struggle.”"
" “Though Destiny a hundred times waylays you,in the end it pitches a tent for you in Heaven. It is God's loving kindness to terrify you,in order to lead you to His Kingdom of safety. ”"
"“There came one and knocked at the door of the Beloved.
And a voice answered and said, 'Who is there?'
The lover replied, 'It is I.'
'Go hence,' returned the voice;
'there is no room within for thee and me.'
Then came the lover a second time and knocked and again the voice demanded, 'Who is there?'
He answered, 'It is thou.'
'Enter,' said the voice, 'for I am within.”"
"“There is a way between voice and presence, where information flows. In disciplined silence it opens; with wandering talk it closes.”"
"“When the light returns to its source, it takes nothing of what it has illuminated.”"
"“Dancing is not just getting up painlessly, like a leaf blown on the wind; dancing is when you tear your heart out and rise out of your body to hang suspended between the worlds.”"
"“If I gaze at my beloved she may feel embarrassed and if I do not,
 she will feel neglected.
I can see the stars reflecting in the calm water of her face but if I look away
I lose my clarity.”"
“You are my shams.”
“Move outside the tangle of fear-thinking. Live in silence.”
" “Some Hindus have an elephant to show.
No one here has ever seen an elephant.
They bring it at night to a dark room.
One by one, we go in the dark and come out saying how we experience the animal.
One of us happens to touch the trunk.
A water-pipe kind of creature.
Another, the ear. A strong, always moving back and forth, fan-animal. Another, the leg.
I find it still, like a column on a temple. Another touches the curve back.
A leathery throne. Another, the cleverest, feels the tusk. A rounded sword made of porcelain. He is proud of his description.
 Each of us touches one place
and understands the whole in that way.
The palm and the fingers feeling in the dark
are how the senses explore the reality of the elephant. If each of us held a candle there,
and if we went in together, we could see it.”"
"""God splash heart with blood and tears before making any secrets in there ..."""
"“Although the road is never ending take a step and keep walking,
do not look fearfully into the distance. On this path let the heart be your guide for the body is hesitant and full of fear.”"
"“We may know who we are or we may not. We may be Muslims, Jews or Christians but until our hearts become the mould for every heart we will see only our differences.”"
“Your magnificence has made me a wonder. Your charm has taught me the way of love.”
"“True beauty is a ray That springs from the sacred depths of the soul, and illuminates the body, just as life springs from the kernel of a stone and  gives colour and scent to a flower.”"
"“Listen, O drop, give yourself up without regret, and in exchange gain the Ocean. Listen, O drop, bestow upon yourself this honor, and in the arms of the Sea be secure. Who indeed should be so fortunate? An Ocean wooing a drop! In God's name, in God's name, sell and buy at once! Give a drop, and take this Sea full of pearls.”"
" “Love asks us to enjoy our life For nothing good can come of death. Who is alive? I ask. Those who are born of love. Seek us in love itself, Seek love in us ourselves. Sometimes I venerate love, Sometimes it venerates me.”"
"“Drumsound rises on the air, its throb, my heart. A voice inside the beat says, 'I know you're tired, but come. This is the way.”"
" “There is another language beyond language, another place beyond heaven and hell. Precious gems come from another mine, the heart draws light from another source.”"
"“Love rests on no foundation. It is an endless ocean, with no beginning or end.”"
“Observe the wonders as they occur around you. Don't claim them. Feel the artistry moving through and be silent. Don't grieve. Anything you lose comes round in another form.”
“Lovers don't finally meet somewhere. They're in each other all along.”
"“God has allowed some magical reversal to occur, so that you see the scorpion pit as an object of desire, and all the beautiful expanse around it as dangerous and swarming with snakes.”"
“Let the beauty we love be what we do. There are hundreds of ways to kneel and kiss the ground.” “What? Are you still pretending you are separate from the Beloved?”
“If I can only recount  the story of my life right out of my body flames will grow.”
“Observe the wonders as they occur around you. Don’t claim them. Feel the artistry moving through and be silent.”
"“Body of earth, don't talk of earth Tell the story of pure mirrors The Creator has given you this splendor-- Why talk of anything else?”"
"""If we come to sleep we are His drowsy ones 
And if we come to wake we are in His hands 
If we come to weeping we are His cloud full of raindrops 
And if we come to laughing we are His lightning in that moment#
If we come to anger and battle it is the reflection of His wrath 
And if we come to peace and pardon it is the reflection of His love 
Who are we in this complicated world?"""